model,role,training_cache,controlled_for_final_story,ood_val_evidence,calibration_evidence,operating_point_evidence,readiness_status,recommended_use_in_manuscript
old_plain_erm_context,context-only baseline,old confounded balanced cache (pc1000; center<->label confound; center 4 absent),no,"ood_val AUROC 0.7696 (highest ranking, but context-only)",5A temperature scaling (T=3.1224) on ood_val (development-stage),candidate id_val-selected points (7B/7C); none committed,context-only; NOT a controlled comparator,Report as prior/context reference and motivation; never as a controlled DG comparator.
stain_aug_7a_context,context-only baseline (moderate torchvision stain aug),old confounded balanced cache (pc1000) + moderate stain aug,no,ood_val AUROC 0.7492; did not beat plain-ERM ranking,7C temperature scaling on ood_val (development-stage),candidate id_val-selected points (7C); none committed,context-only; negative/mixed stain lever,Report as a stain-augmentation lever that did not beat plain-ERM ranking.
stain_aug_7d_context,context-only baseline (tuned torchvision stain aug v2),old confounded balanced cache (pc1000) + tuned stain aug v2,no,ood_val AUROC 0.7397; below plain and 7A,none (no calibration in 7D),candidate id_val-selected points (7D); none committed,context-only; negative stain lever,Report as a negative/mixed comparator; do not promote.
stain_space_7e_context,context-only baseline (OD/HED stain-space aug),old confounded balanced cache (pc1000) + OD/HED stain-space aug,no,ood_val AUROC 0.7317 (lowest); strongest stain variant at fixed-spec operating points,none (no calibration in 7E),candidate id_val-selected points (7E); none committed,"context-only; strongest stain operating-point behavior, lowest AUROC",Report as the strongest stain variant at operating points but below plain-ERM ranking.
centerstrat_erm_7f_control,matched control (fair DG baseline),"NEW center-stratified sound cache (7F-1; centers {0,3,4} x labels balanced)",yes,ood_val AUROC 0.6180 (matched control for GroupDRO),7G temperature scaling (T=3.9239) on ood_val (development-stage; R7),candidate id_val-selected fixed-specificity points (7G); none committed,controlled baseline; development-stage,Report as the matched ERM control in the controlled DG comparison.
groupdro_7f_candidate,PRIMARY controlled candidate (+ temperature-scaled confidence),"NEW center-stratified sound cache (7F-1; centers {0,3,4} x labels balanced)",yes,ood_val AUROC 0.7129 vs matched ERM 0.6180 (+0.0949); 4/4 fixed-spec sensitivity wins,7G temperature scaling (T=3.6570) on ood_val; better-calibrated than ERM raw+cal (development-stage; R7),candidate id_val-selected fixed-specificity points (7G); none committed,primary candidate; development-stage; NOT frozen as final,Report as the first positive controlled DG lever (vs matched ERM control only).
