model,role,checkpoint_path,prediction_path_current_if_any,controlled_comparison_status,include_in_full_dev_eval,reason,frozen_for_next_execution
7F GroupDRO,primary controlled candidate (+ temperature-scaled confidence),results/checkpoints/exp07f_groupdro_resnet18/best.pt,results/predictions/exp07f_groupdro_resnet18,controlled (vs 7F center-stratified ERM),yes,First DG lever to beat its matched control on OOD (ood_val AUROC 0.7129 vs 0.6180); better-calibrated,yes
7F center-stratified ERM,matched control,results/checkpoints/exp07f_centerstrat_erm_resnet18/best.pt,results/predictions/exp07f_centerstrat_erm_resnet18,controlled (matched baseline for GroupDRO),yes,"Only fair baseline (same sound 7F-1 cache, matched init/seed/schedule); required so comparison scales",yes
old plain ERM,context-only baseline,results/checkpoints/exp04a_dev_train_resnet18/best.pt,results/predictions/exp04a_dev_train_resnet18 + exp05a_calibrate_ood_val_resnet18,context-only (old confounded cache; different id_val subset),optional,"Reference/motivation only; ood_val AUROC 0.7696 is a reference gap, NOT a controlled loss",no
7A moderate stain/color augmentation,context-only baseline,results/checkpoints/exp07a_stainaug_resnet18/best.pt,results/predictions/exp07a_stainaug_resnet18,context-only (old confounded cache + stain aug),optional,Negative/mixed stain lever; did not beat plain-ERM ranking (ood_val AUROC 0.7492),no
7D tuned stain/color augmentation v2,context-only baseline,results/checkpoints/exp07d_stainaug_v2_resnet18/best.pt,results/predictions/exp07d_stainaug_v2_resnet18,context-only (old confounded cache + tuned stain aug v2),optional,Negative stain lever; below plain and 7A (ood_val AUROC 0.7397),no
7E OD/HED-style stain-space augmentation,context-only baseline,results/checkpoints/exp07e_stainspace_resnet18/best.pt,results/predictions/exp07e_stainspace_resnet18,context-only (old confounded cache + OD/HED stain-space aug),optional,Strongest stain variant at fixed-spec operating points but lowest AUROC (0.7317),no
