risk_id,risk,previous_severity,current_status_after_7G,residual_severity,mitigation_completed,remaining_action,manuscript_disclosure
R1,Capped balanced subsets are not a real/final evaluation,HIGH,"OPEN (unchanged): all 7F/7G results are on capped balanced subsets (id_val n=450/500, ood_val n=2000).",HIGH,Every 7H artifact carries the development / capped-subset scope tag.,Full-split evaluation + final locked ood_test run (gated).,"State capped-subset development scope in Limitations; frame as reliability/DG audit, not performance."
R3,No domain-generalization baseline,HIGH,"PARTLY MITIGATED (reduced): a dedicated DG method (GroupDRO-by-center) was implemented and, in the controlled 7F setup, beat its matched center-stratified ERM control on ood_val AUROC/AUPRC and 4/4 fixed-specificity sensitivity targets.",MEDIUM,GroupDRO implemented (src/training/groupdro.py); matched controlled comparison (7F) + calibration audit (7G) done; consolidated in 7H.,Only GroupDRO tested; add CORAL/DANN and full/final evaluation before any superiority claim (all gated).,Report GroupDRO as the first positive DG lever in the controlled setup; disclose that CORAL/DANN and final test remain future work.
R4,No full ood_val / no full-test evaluation yet,HIGH,OPEN (unchanged): ood_test remains LOCKED and unread; all OOD numbers are the capped balanced ood_val subset.,HIGH,Reserved-test discipline maintained; ood_test never touched in 7A-7H.,"Single final locked ood_test evaluation + full ood_val (gated, one-time).",Present reserved-test discipline as a protocol feature; no generalization number until the locked run.
R7,Calibration fitted and evaluated on the same ood_val subset,HIGH,OPEN (unchanged): 7G temperature scaling for both 7F models was fit AND evaluated on the same capped ood_val subset (optimistic).,MEDIUM-HIGH,Disclosed as a limitation; calibration claims kept narrow ('improves calibration on this subset'); argmax-invariance stated.,Separate calibration vs evaluation folds (or fit-on-one-hospital/eval-on-another) before any 'calibration generalizes' claim (gated).,Prominent Limitations disclosure; narrow calibration claim only.
R8,Deterministic-only uncertainty,MEDIUM,OPEN (unchanged): only single-forward-pass entropy/confidence + temperature scaling; no MC-dropout/ensemble.,MEDIUM,Scope limited to deterministic uncertainty; model-based uncertainty explicitly deferred/optional.,MC-dropout / deep ensembles (deferred/optional; gated).,Scope uncertainty claims to deterministic; present ID-vs-OOD gap as motivation for model-based uncertainty.
R9,Possible class-order / cache sampling bias,MEDIUM,"PARTLY MITIGATED: 7F-1 center-stratified rebuild removed the center<->label confound for DG training (per-(center,label) quota sampling across {0,3,4}); provenance documented.",MEDIUM,Center-stratified sound caches built (7F-1); label-ordered-stream handling + seeds documented.,Full-split evaluation to remove subsetting entirely (gated).,Document seeded balanced caching + center-stratified rebuild; report seeds and cache provenance.
